star,comment
2.0,null
0.25,null
2.0,null
3.25,"Maltes: Laphroaig, Bowmore, Caol Ila, Ardbeg e Port Ellen.

Olfato: moderadamente turfado, cinzas, fogueira de acampamento, baunilha, malte, sugestões de costa marinha, gramíneas, madeira molhada, cítrico e doce. Um pouco de álcool é perceptível.

Paladar: dulçor, apimentado, cinzas, defumado de turfa, costa marinha (mais evidente do que no aroma), salgado, levemente amargo, cremoso e seco. O álcool continua perceptível.

Finalização: média para longa. Boas notas de amargos e picância vindo à tona. 

Impressões gerais: whisky jovem e o álcool no aroma e palato entrega isso. Vendido em amostras pequenas, este whisky não foi um bom custo x benefício. Os whiskies que compõem este blended malt são ótimos, mas não foram bem casados em minha opinião, talvez 12 anos de idade e mais dulçor fizessem bem a este whisky. Entretanto, é muito bom saber que ao menos alguma parte deste blended malt (acredito que a menor parte) é composta por maltes da Port Ellen, destilaria desativada em 1983, mas que ainda possui whiskies em seus warehouses."
